{
  "candidate_hash": "sha256:556083dd71ed01078f5bd1a6164abd88660824ed2170030d0bfa13f0cdd00b6d",
  "candidate_id": "candidate_fb4a3fd06ced1113d27bacd8",
  "evaluated_at": "2026-01-01T00:00:00Z",
  "findings": [
    {
      "code": "CANDIDATE_HASH_VALID",
      "message": "Canonical candidate hash must match its deterministic payload.",
      "passed": true,
      "severity": "error"
    },
    {
      "code": "EVIDENCE_BUNDLE_BOUND",
      "message": "Candidate must bind the exact authorized evidence bundle.",
      "passed": true,
      "severity": "error"
    },
    {
      "code": "EVIDENCE_REFERENCE_VALID",
      "message": "Candidate evidence must resolve exactly in the authorized bundle.",
      "passed": true,
      "severity": "error"
    },
    {
      "code": "SCOPE_MATCH",
      "message": "Run, evidence, and bundle scopes must match.",
      "passed": true,
      "severity": "error"
    },
    {
      "code": "DISCLOSURE_SAFE",
      "message": "Sensitive categories require explicit redaction intent.",
      "passed": true,
      "severity": "error"
    },
    {
      "code": "LIMITATION_PRESENT",
      "message": "Consequential outputs must state at least one limitation.",
      "passed": true,
      "severity": "warning"
    }
  ],
  "result_hash": "sha256:310b1bbad7a629b9f792615d4d3b6ad2b2abe9e7dd6da3a76ab06eaf5095722f",
  "result_id": "verification_94c751a61227f59b8e037855",
  "status": "pass",
  "verifier_id": "provable_agent_reference.verifier",
  "verifier_version": "0.1.0"
}
